index,Job Title,Salary Estimate,Job Description,Rating,Company Name,Location,Size,Founded,Type of ownership,Industry,Sector,Revenue,Hourly,Employer provided,Min Salary,Max Salary,Avg Salary,Company_text,State,Age,Python,Tableau,Excel,Power BI,SAS,SQL,SSIS
1,Entry Level Data Conversion Analyst,$35K - $71K (Glassdoor est.),"As the Data Conversion Analyst, you will be converting customer data from competitive databases to Reynolds databases. You will also complete migration of customer data from one Reynolds hardware platform to another. This involves maintaining a good working relationship with customers throughout the conversion or migration process to ensure quality results. You will also be supporting remote and field-based trainers and field engineers on the conversion and migration processes. Through this, you will develop a good working knowledge of competitive products, keep abreast of enhancements to the Reynolds product lines as well as develop knowledge of system environment, integration, and system connectivity for different product lines.
Requirements:
Bachelor’s degree in MIS, Computer Science, or related field; open to entry-level candidates",3.4,"Reynolds and Reynolds
3.4","Dayton, OH",1001 to 5000 Employees,1866,Company - Private,Computer Hardware & Software,Information Technology,$2 to $5 billion (USD),0,0,35,71,53.0,Reynolds and Reynolds, OH,156,0,0,0,0,0,0,0
3,Senior Data Analyst with Visualization (No sponsorship candidates),$63K - $149K (Glassdoor est.),"Senior Data Analyst with Visualization (No sponsorship candidates)
The Sales Enablement team of Meta Reality Labs is looking for an experienced operations data analyst to help with operational data analysis, design and develop visualizations, dashboards for the tools and processes supported by the Sales Enablement Team.
The primary objective of this position is to enable the Technical Solution Leads and the support teams to decipher operational data in a meaningful way - through dashboards, visualizations and enable them to make business and technical decisions - to meet customer and partner requirements and scale the business. The goal is to improve productivity of the internal teams, increase operating rigor and meet all compliance requirements. The objective is to support the operations of our systems by displaying operational metrics and data sets needed to explore any issues and performance",3.7,"HCL Technologies
3.7","Burlingame, CA",10000+ Employees,1991,Company - Public,Computer Hardware & Software,Information Technology,$5 to $10 billion (USD),0,0,63,149,106.0,HCL Technologies, CA,31,0,0,0,0,0,0,0
4,Data Analyst,$43K - $88K (Glassdoor est.),"Dematic is looking for a Data Analyst that will be responsible for creating and providing financial reporting, analysis and insight to support strategic, operational, and financial decision making. This role will report to the Sr. Manager, FP&A for the Global Software Organization. The ideal candidate will be highly analytical with good interpersonal skills and a commercial focus with a keen interest in using and developing reporting and tooling. This is a critical role in developing an agile organization based on data insight.
What we offer:
Job Description -
Career Development
Competitive Compensation and Benefits
Pay Transparency
Global Opportunities",3.8,"Dematic
3.8","Atlanta, GA",5001 to 10000 Employees,1819,Subsidiary or Business Segment,Logistics & Supply Chain,Transportation & Logistics,Unknown / Non-Applicable,0,0,43,88,65.5,Dematic, GA,203,0,0,0,0,0,0,0
5,Data Analyst,Employer Provided Salary:$45 - $65 Per Hour,"We are looking for a passionate certified Data Analyst. The successful candidate will turn data into information, information into insight and insight into business decisions. Data analyst responsibilities include conducting full lifecycle analysis to include requirements, activities and design. Data analysts will develop analysis and reporting capabilities. They will monitor performance and quality control plans to identify improvements.
Responsibilities
Interpret data, analyze results using statistical techniques and provide ongoing reports
Develop and implement databases, data collection systems, data analytics and other strategies that optimize statistical efficiency and quality
Acquire data from primary or secondary data sources and maintain databases/data systems",4.2,"WorkCog
4.2","Atlanta, GA",51 to 200 Employees,2017,Company - Private,IT Services,Information Technology,Unknown / Non-Applicable,1,1,45,65,55.0,WorkCog, GA,5,0,0,0,0,0,0,0
7,North America Data Analyst,$56K - $100K (Glassdoor est.),"This role is responsible for collecting, interpreting and communicating Public Affairs, Communications, and Sustainability (PACS) insights and partnering with Operating Unit (OU) leads to convert them into actionable strategies, decisions and tactics. The ideal candidate will serve as a conduit between the PACS Services team and the OU, establishing a constant connection between both groups and forming a two-way communication channel that can be leveraged to achieve both OU and global business objectives. The role is critical to scaling PACS Services insights and tailoring them to help each OU reach its goals and influence stakeholders.
Responsibilities
Define OU-specific PACS KPIs and outline the optimal means of tracking them over time
Help quantify the success of PACS communications campaigns and initiatives
Reputation Research; Reputation Management; Taking Initiative; Strategic Planning; Consumer Behavior Insights; Corporate Reputation; Presentations; Microsoft Power BI; Strategic Recommendations; Corporate Reputation Management; Microsoft Excel; Data Insights; Analytics Insights",4.0,"The Coca-Cola Company
4.0","Atlanta, GA",10000+ Employees,1886,Company - Public,Food & Beverage Manufacturing,Manufacturing,$10+ billion (USD),0,0,56,100,78.0,The Coca-Cola Company, GA,136,0,0,1,1,0,0,0
8,Data Analyst,$43K - $85K (Glassdoor est.),"Home Care Assistance is hiring a Data Analyst to join our Data, Analytics and Reporting (DART) team!

As the Data Analyst your primary responsibility is to support the HCA data warehouse and ensure that data is accurate and available for reporting, analytics, and other stakeholders. You will analyze the raw source data using SQL queries and then work as part of a team to develop structures that make the data easier for reporting and analytics users to understand and leverage.

This is a fully remote role.",3.6,"Home Care Assistance
3.6","La Jolla, CA",5001 to 10000 Employees,2002,Company - Private,Health Care Services & Hospitals,Health Care,$100 to $500 million (USD),0,0,43,85,64.0,Home Care Assistance, CA,20,0,0,0,0,0,1,1
11,Data Analyst,$65K - $119K (Glassdoor est.),"Come and join the Microsoft Browser Data Science team where we thrive on data to solve high impact business problems! We enable data driven decisions by converting data into insights that enhance customer experiences and improve business performance.

We partner closely with Engineering, Marketing, and Finance teams to answer key questions related to product adoption, engagement, satisfaction and monetization. Our work requires regular collaboration with our partner teams as well as technical expertise to mine big datasets and discover key insights.

To support this mission, we are looking for Data Analysts who have a passion for analyzing big data to uncover customer usage insights and driving those insights into actions with our partner teams.

The ideal candidate should be self-directed, passionate about data, and focused on delivering the right results. The candidate should be able to understand product strategy and business goals and apply programming acumen and a breadth of tools, data sources and analytical techniques to answer a wide range of high-impact business questions and present the insights in a concise and effective manner. Experience partnering with data scientists to develop business metrics and related insights is a big plus. Technical aptitude and programming skills are necessary in this role. The candidate should be an effective communicator capable of independently driving issues to resolution and communicating insights to different audiences ranging from executives to engineering feature teams.",4.4,"Microsoft
4.4","Redmond, WA",10000+ Employees,1975,Company - Public,Computer Hardware & Software,Information Technology,$10+ billion (USD),0,0,65,119,92.0,Microsoft, WA,47,0,0,0,0,0,0,0
14,Data Analyst,Employer Provided Salary:$52K - $75K,"When you’re the best, we’re the best. We instill an environment where employees feel engaged, satisfied and able to contribute their unique skills and talents. We provide extensive opportunities for personal and professional development, building both employee competence and organizational capability to fuel exceptional performance now and in the future.
Summary:
In this role, you will collaborate with Business Analysts and Data Architects. You will document current usage of data and its appropriate storage structures for use within the current business unit and across other lines of business. You will work with multiple data sources and across business lines to develop new data capabilities. You will create data models, data catalog, define metadata and recommend usage of such data. You will present recommendations to management and external stakeholders and provide guidance in selecting alternatives with impact to the team and the functional area’s bottom line. You will provide guidance, training, and mentorship to other analysts and team members.
$51,900.00 - $75,150.00",4.0,"Vizient, Inc.
4.0","Irving, TX",1001 to 5000 Employees,1977,Company - Private,Health Care Services & Hospitals,Health Care,$500 million to $1 billion (USD),0,1,52,75,63.5,"Vizient, Inc.", TX,45,0,0,0,0,0,0,0
16,Data Analyst (10-15 hours/week),$55K - $133K (Glassdoor est.),"RedCloud is seeking a Data Analyst (10 – 15 hours/week) to support immediate client operations. RedCloud Consulting is a business and IT consulting company with local Puget Sound Enterprise and Mid-sized clients. We have been recognized by Seattle Business Magazine and ranked #1 on their “Best Companies to Work for in Washington” for Mid-Sized Businesses list, awarded #1 Fastest Growing Company in Washington by Puget Sound Business Journal, and named on the Inc. 500/5000 list.


Responsibilities include but are not limited to:
Establish weekly insights for sales managers and drive appropriate actions (ex: follow up actions to close with seller).",4.9,"Redcloud Consulting
4.9","Redmond, WA",51 to 200 Employees,1995,Company - Private,Consulting,Business Services,Unknown / Non-Applicable,0,0,55,133,94.0,Redcloud Consulting, WA,27,0,0,0,0,0,0,0
26,"Data Entry Analyst (East Coast, Remote)",$26K - $59K (Glassdoor est.),"Data Entry Analyst

The Company:

Coleman Research is a leading global expert network and primary research company serving investment management firms, management consultancies, hedge funds, mutual funds, and private equity firms with their due diligence processes. Our network of roughly 250,000 professionals provides expertise and insights on industries ranging from healthcare to technology to retail and beyond. We connect clients and experts via phone and in-person consultations, conference events, custom surveys and moderated roundtable events. Headquartered in the heart of New York City, with additional offices in Hong Kong, London, Raleigh and Los Angeles, our 200+ employees collaborate across the globe to meet our client needs.",4.1,"Coleman Research
4.1","Raleigh, NC",201 to 500 Employees,2003,Company - Private,Consulting,Business Services,Unknown / Non-Applicable,0,0,26,59,42.5,Coleman Research, NC,19,0,0,0,0,0,0,0
30,"ANALYST, DATA",$53K - $106K (Employer est.),"Identify new sources of data and methods to improve data collection, analysis, and reporting. Collect customer requirements, design reports to meet data analysis needs.
ESSENTIAL JOB FUNCTIONS / PRINCIPAL ACCOUNTABILITIES:
Collect, analyze, assess potential risks, and report data to meet customer needs.
Use automated tools to extract data from primary and secondary sources.
Analyze existing tools and databases and provide software solution recommendations.
Train end-users on new reports and dashboards.
Provide technical expertise in data storage structures, data mining, and data cleansing.",3.2,"McLane Company
3.2","Temple, TX",10000+ Employees,1894,Subsidiary or Business Segment,Logistics & Supply Chain,Transportation & Logistics,$10+ billion (USD),0,0,53,106,79.5,McLane Company, TX,128,0,0,0,0,0,0,0
32,Data Analyst,$53K - $106K (Employer est.),"Our People & Places Solutions business – reinforces our drive to improve the lives of people everywhere and epitomizes the ""why"" of what we do – the tremendous positive impact and value our solutions bring to our communities and society as a whole. From facilities delivering life-saving therapies and ensuring clean water to enabling the connection of people through all modes of transportation and providing access to technology – we're integrating a multitude of these solution elements to build the smart environments of tomorrow.

Start your Jacobs career with a company that inspires and empowers you to deliver your best work so you can evolve, grow and succeed – today and into tomorrow.


Your Impact:


Jacobs is an Equal Opportunity/Affirmative Action Employer. All qualified applicants will receive consideration for employment without regard to race, religion, creed, color, national origin, ancestry, sex (including pregnancy, childbirth, breastfeeding, or medical conditions related to pregnancy, childbirth, or breastfeeding), age, medical condition, marital or domestic partner status, sexual orientation, gender, gender identity, gender expression and transgender status, mental disability or physical disability, genetic information, military or veteran status, citizenship, low-income status or any other status or characteristic protected by applicable law. Learn more about your rights under Federal EEO laws and supplemental language.",3.9,"Jacobs
3.9","Redding, CA",10000+ Employees,1947,Company - Public,Architectural & Engineering Services,Business Services,$10+ billion (USD),0,0,53,106,79.5,Jacobs, CA,75,0,0,0,0,0,0,0
33,Data Analyst,$53K - $106K (Employer est.),"L'Oréal USA
Title: Data Analyst
Location: Berkeley Heights, NJ
Department: le Care (Consumer Care)
Overview:
The data analyst, le CARE L’Oreal USA, is responsible for data query, data QA, data integration, ad hoc data analysis, and advanced BI dashboard/report building on large volume of consumer contact data and managing projects.

We are an Equal Opportunity Employer and take pride in a diverse environment. We do not discriminate in recruitment, hiring, training, promotion or other employment practices for reasons of race, color, religion, gender, sexual orientation, national origin, age, marital or veteran status, medical condition or disability, or any other legally protected status. If you require a reasonable accommodation to complete an application for a recognized disability under applicable law, please email USApplicationAccommodation@support.lorealusa.com. Please note this email will only respond to specific requests for assistance completing the application as a request for accommodation for a disability. All others will not be considered.",3.9,"L'Oreal
3.9","Berkeley Heights, NJ",10000+ Employees,1909,Company - Private,Consumer Products Manufacturing,Manufacturing,$10+ billion (USD),0,0,53,106,79.5,L'Oreal, NJ,113,0,0,0,0,0,0,1
38,Data Analyst,$53K - $106K (Employer est.),"Job Description :
Data analysts seek to describe the current state of reality for the organizations by translating data into information accessible to the business. They collect, analyze, and report on data to meet business needs. The role includes identifying new sources of data and methods to improve data collection, analysis, and reporting.
Develop and maintain production quality data pipelines. Build the infrastructure required for extraction, transformation and loading of data from a wide variety of data sources ranging from SQL to “big data” technologies.",3.1,"ScribeAmerica
3.1","Fort Lauderdale, FL",10000+ Employees,2004,Company - Private,Health Care Services & Hospitals,Health Care,$100 to $500 million (USD),0,0,53,106,79.5,ScribeAmerica, FL,18,0,0,0,0,0,1,0
41,Data Analyst,$53K - $106K (Employer est.),"At HSBC, the health and well-being of our employees remains of utmost importance. Many of our roles are permitted to work from home (in states in which HSBC is licensed to operate) until further notice. Upon resumption of normal operations, this role may be performed at our Jersey City, New Jersey office.

US Wholesale CDAO function was initially established in December 2020 as part of a HSBC wide program to improve the management of data across the Wholesale organization. As the function has continued to evolve, the team is looking to build out Data Analysis & Remediation capabilities.
About Us",3.8,"HSBC
3.8","Jersey City, NJ",10000+ Employees,1865,Company - Public,Banks & Credit Unions,Finance,$10+ billion (USD),0,0,53,106,79.5,HSBC, NJ,157,0,0,0,0,0,0,0
42,"Analyst, Revenue Data Analytics",$53K - $106K (Employer est.),"Who we are...
AvantStay delivers exceptional, unique stays for group travelers. The company has built a tech-enabled millennial hospitality brand to be the new standard for group experience. We are venture funded and growing rapidly in the explosive $100+ billion dollar STR industry.

What we are looking for…
AvantStay is looking for an Analyst, Revenue Data Analytics to lead our ongoing data collection, visualization, and analysis efforts on our Revenue Management, Finance, and stakeholder teams. These efforts are key to enabling the optimization of revenue and dynamic pricing practices, underwriting and other financial and analytical actions which are central to our continued success as we grow into new markets and increase the number of properties in our portfolio each month.

Ideal candidate is a technical, data-driven Analyst who is an expert at accessing data via our data warehouse and APIs, developing dashboards and analysis and leveraging your data science skills to help provide insights and improve our decision-making strategies. You thrive in a high growth environment and have a high degree of operational rigor. You thrive working cross-functionally and can work with a high degree of autonomy, flexibility and ability to think on your feet.",4.6,"AvantStay
4.6",Remote,201 to 500 Employees,2017,Company - Private,Real Estate,Real Estate,Unknown / Non-Applicable,0,0,53,106,79.5,AvantStay,Remote,5,0,0,0,0,0,0,0
43,Data Analyst,$53K - $106K (Employer est.),"Product Analyst
We have an outstanding opportunity for a Product Analyst to contribute in a fast paced, growing organization. The position includes quantitative data analysis for the purpose of determining profitable pricing opportunities and a variety of projects to enhance the company’s product offering.
American Freedom Insurance Company, a financially strong “A+” rated “Superior” by A.M. Best (the most highly respected insurance rating organization) is seeking a responsible and hard-working individual to join our team. We are a mid-sized, profitable and expanding nonstandard automobile insurance company doing business in Illinois, Indiana, Pennsylvania and Tennessee (Texas coming soon). This position is located in Mount Prospect, IL, a suburb of Chicago.
Qualifications:",4.5,"American Freedom Insurance Company
4.5","Mount Prospect, IL",51 to 200 Employees,1997,Company - Private,Insurance Carriers,Insurance,Unknown / Non-Applicable,0,0,53,106,79.5,American Freedom Insurance Company, IL,25,0,0,0,0,0,0,0
45,Data Analyst,$53K - $106K (Employer est.),"Data Analyst
<br>
Job Description
<br>
Data Analyst - Apartments.com - Atlanta, GA
Overview:
Apartments.com is the leading online apartment listing website, connecting renters to more than 1mm rentals across the country. Powered by CoStar, the Apartments.com network of home rental sites includes Apartments.com, ApartmentFinder.com, Apartamentos.com, ForRent.com, ApartmentHomeLiving.com, and WestsideRentals.com. These unique rental sites offer advertisers expansive exposure for their available rental listings of all kinds.",2.8,"CoStar Group
2.8","Atlanta, GA",1001 to 5000 Employees,1987,Company - Public,Computer Hardware & Software,Information Technology,$1 to $2 billion (USD),0,0,53,106,79.5,CoStar Group, GA,35,0,0,0,0,0,0,0
46,Data Analyst,$53K - $106K (Employer est.),"General Responsibilities:
Overview:
Hertz and the Value Added Services Sales Team is seeking a talented individual with passion for real-world problem solving. The analyst will partner with various functions within the company (Operations, Value Added Services, Compensation, etc…) and develop advanced tools and resources to support overall sales planning and analytics. The analyst will be working with large sets of structured and unstructured data to perform analysis, develop tools, and provide actionable insights. This is a remote position!

What you’ll be doing:
Develop tools for the field for sales metric tracking.



:",3.0,"Hertz
3.0","Estero, FL",10000+ Employees,1918,Company - Public,Car Rental,Travel & Tourism,$5 to $10 billion (USD),0,0,53,106,79.5,Hertz, FL,104,0,0,0,0,0,0,0
47,Senior Data Analyst,$53K - $106K (Employer est.),"The Enterprise and Risk Compliance Technology team is looking for a Sr. Data Analyst to drive our internal customer experience strategy forward in Governance Risk and Compliance (GRC) area by consistently innovating and problem-solving. The ideal candidate is passionate about the internal partners experience journey, highly motivated, intellectually curious, analytical, and possesses an entrepreneurial mindset.

Role
In this role, you will demonstrate:
Strong ability working alongside business partners to gather requirements.
Strong ability in collection, interpretation, and analysis of data.
Reporting the results to business partners and team.
All About You

Corporate Security Responsibility
Every person working for, or on behalf of, Mastercard is responsible for information security. All activities involving access to Mastercard assets, information, and networks comes with an inherent risk to the organization and therefore, it is expected that the successful candidate for this position must:

In the US, Mastercard is an inclusive Equal Employment Opportunity employer that considers applicants without regard to gender, gender identity, sexual orientation, race, ethnicity, disabled or veteran status, or any other characteristic protected by law. If you require accommodations or assistance to complete the online application process, please contact reasonable_accommodation@mastercard.com and identify the type of accommodation or assistance you are requesting. Do not include any medical or health information in this email. The Reasonable Accommodations team will respond to your email promptly.",4.2,"MasterCard
4.2","O'Fallon, MO",10000+ Employees,1966,Company - Public,Financial Transaction Processing,Finance,$5 to $10 billion (USD),0,0,53,106,79.5,MasterCard, MO,56,0,0,0,0,0,0,1
48,Data Analyst,$53K - $106K (Employer est.),"Why Glassdoor?
Our mission is to help people everywhere find a job and company they love. In the process, we're transforming the workplace experience through the power of transparency and further cementing ourselves as the worldwide leader in employer branding and insights. By choosing a career at Glassdoor, you'll be directly contributing toward our vision for a world where transparency empowers the workforce and motivates companies to become better employers.
Please note: This role may be open to remote hiring. Our office locations are in San Francisco, CA; Chicago, IL; Uniontown, OH; London, UK; and Dublin, Ireland.
The Role
We're looking for a dedicated and inquisitive Data Analyst to help us with data projects. We are responsible for building and maintaining a large data set that powers integration points between us and partnered companies. This individual will be critical in helping to build and maintain coverage, identify data quality issues, reconcile and resolve data validation issues, and respond to internal data mapping requests from other customers, staff and partners.",4.0,"Glassdoor
4.0","San Francisco, CA",501 to 1000 Employees,2007,Company - Private,Internet,Information Technology,Unknown / Non-Applicable,0,0,53,106,79.5,Glassdoor, CA,15,0,0,0,0,0,0,0
52,Data Analyst,$53K - $106K (Employer est.),"Apply Here: https://secure.onehcm.com/ta/SCCCI.jobs?ShowJob=419619585&TrackId=Indeed
Position Summary:
The Data Analyst is responsible for organizing data from our EHR systems and providing actionable insights that helps SCCC leadership make business decisions and comply with reporting requirements. The Data Analyst works to make sure that the data is collected properly, observing any legal or ethical standards are met, and reported in accordance with applicable requirements. The position requires cross functional collaboration with all departments.
The Data Analyst must demonstrate regard for the rights of all patients and provides respectful and considerate care focused on the patient's individual needs. Data Analyst will provide a safe and confidential environment for patients, families, and personnel.",4.2,"Summit Community Care Clinic
4.2","Frisco, CO",51 to 200 Employees,1993,Nonprofit Organization,Social Assistance,Non-Profit,Unknown / Non-Applicable,0,0,53,106,79.5,Summit Community Care Clinic, CO,29,0,0,0,0,0,0,0
